{
  "schemaVersion": 1,
  "tolerances": {
    "absolute": 1e-07,
    "relative": 0.0001
  },
  "provenance": {
    "source": "analytical"
  },
  "backends": [
    "roadrunner",
    "copasi"
  ],
  "reports": {
    "r": {
      "file": "00160.r.csv",
      "format": "csv",
      "dtype": "number",
      "ndim": 1,
      "labels": {
        "rows": true,
        "columns": false
      }
    }
  }
}
