{
  "schemaVersion": 1,
  "tolerances": {
    "absolute": 1e-07,
    "relative": 0.0001
  },
  "provenance": {
    "source": "analytical"
  },
  "backends": [
    "roadrunner",
    "copasi",
    "opencor"
  ],
  "reports": {
    "col": {
      "file": "00106.col.csv",
      "format": "csv",
      "dtype": "number",
      "ndim": 1
    },
    "t": {
      "file": "00106.t.csv",
      "format": "csv",
      "dtype": "number",
      "ndim": 1
    },
    "last": {
      "file": "00106.last.csv",
      "format": "csv",
      "dtype": "number",
      "ndim": 0
    },
    "row": {
      "file": "00106.row.csv",
      "format": "csv",
      "dtype": "number",
      "ndim": 1,
      "labels": {
        "rows": true,
        "columns": false
      }
    },
    "mid": {
      "file": "00106.mid.csv",
      "format": "csv",
      "dtype": "number",
      "ndim": 1
    }
  }
}
