{
  "schemaVersion": 1,
  "tolerances": {
    "absolute": 1e-07,
    "relative": 0.0001
  },
  "provenance": {
    "source": "analytical"
  },
  "backends": [
    "roadrunner",
    "copasi",
    "opencor"
  ],
  "reports": {
    "ra": {
      "file": "00007.ra.csv",
      "format": "csv",
      "dtype": "number",
      "ndim": 0
    },
    "rb": {
      "file": "00007.rb.csv",
      "format": "csv",
      "dtype": "number",
      "ndim": 1
    },
    "rc": {
      "file": "00007.rc.csv",
      "format": "csv",
      "dtype": "number",
      "ndim": 2
    }
  }
}
