{
  "schemaVersion": 1,
  "tolerances": {
    "absolute": 1e-07,
    "relative": 0.0001
  },
  "provenance": {
    "source": "analytical"
  },
  "backends": [
    "roadrunner",
    "copasi",
    "opencor"
  ],
  "reports": {
    "r": {
      "file": "00200.r.csv",
      "format": "csv",
      "dtype": "string",
      "ndim": 2,
      "labels": {
        "rows": true,
        "columns": true
      }
    }
  }
}
