{
  "schemaVersion": 1,
  "tolerances": {
    "absolute": 1e-07,
    "relative": 0.0001
  },
  "provenance": {
    "source": "analytical"
  },
  "backends": [
    "roadrunner",
    "copasi",
    "opencor"
  ],
  "reports": {
    "second": {
      "file": "00187.second.csv",
      "format": "csv",
      "dtype": "number",
      "ndim": 0
    },
    "last": {
      "file": "00187.last.csv",
      "format": "csv",
      "dtype": "number",
      "ndim": 0
    },
    "mid": {
      "file": "00187.mid.csv",
      "format": "csv",
      "dtype": "number",
      "ndim": 1
    }
  }
}
