{
  "schemaVersion": 1,
  "tolerances": {
    "absolute": 1e-07,
    "relative": 0.0001
  },
  "provenance": {
    "source": "analytical"
  },
  "backends": [
    "copasi"
  ],
  "reports": {
    "r": {
      "file": "00135.r.csv",
      "format": "csv",
      "dtype": "number",
      "ndim": 2,
      "labels": {
        "rows": false,
        "columns": true
      },
      "compare": {
        "mode": "lastRow",
        "note": "the solver chooses the output points, so only the end of the run is compared"
      }
    }
  }
}
