{
  "schemaVersion": 1,
  "tolerances": {
    "absolute": 1e-07,
    "relative": 0.0001
  },
  "provenance": {
    "source": "analytical"
  },
  "backends": [
    "roadrunner",
    "copasi",
    "opencor"
  ],
  "reports": {
    "c": {
      "file": "00188.c.csv",
      "format": "csv",
      "dtype": "number",
      "ndim": 1
    }
  }
}
