{
  "schemaVersion": 1,
  "tolerances": {
    "absolute": 1e-07,
    "relative": 0.0001
  },
  "provenance": {
    "source": "analytical"
  },
  "backends": [
    "roadrunner",
    "opencor"
  ],
  "reports": {
    "r": {
      "file": "00143.r.csv",
      "format": "csv",
      "dtype": "number",
      "ndim": 2,
      "labels": {
        "rows": false,
        "columns": true
      }
    }
  }
}
